{
    "artifact_type": "proof_of_value_scorecard",
    "dimensions": [
        {
            "claim": "Target-binding/request-shape drift can be classified from local public-safe artifacts.",
            "evidence_paths": [
                {
                    "path": "examples/scope-fidelity-report",
                    "present": true
                },
                {
                    "path": "scripts/build_scope_fidelity_report.py",
                    "present": true
                },
                {
                    "path": "schemas/scope_fidelity_report.v0.1.schema.json",
                    "present": true
                },
                {
                    "path": "schemas/scope_fidelity_report.v0.2.schema.json",
                    "present": true
                }
            ],
            "id": "scope_fidelity",
            "non_claim": "Does not scan hosts or infer authorization beyond supplied artifacts.",
            "status": "passed",
            "title": "Scope fidelity"
        },
        {
            "claim": "Approval/rejection semantics are structured and inspectable in the current lifecycle/review-bundle path.",
            "evidence_paths": [
                {
                    "path": "schemas/policy_decision.v0.2.schema.json",
                    "present": true
                },
                {
                    "path": "engine/public_demo_bundle.py",
                    "present": true
                },
                {
                    "path": "SECURITY_CONTRACT_LAYER.md",
                    "present": true
                }
            ],
            "id": "policy_decision_clarity",
            "non_claim": "Does not prove every live policy configuration is correct.",
            "status": "passed",
            "title": "Policy decision clarity"
        },
        {
            "claim": "The execution contract and scoped ticket can be reviewed without trusting free-form model text.",
            "evidence_paths": [
                {
                    "path": "schemas/execution_contract.v0.2.schema.json",
                    "present": true
                },
                {
                    "path": "schemas/execution_ticket.v0.3.schema.json",
                    "present": true
                },
                {
                    "path": "engine/public_demo_bundle.py",
                    "present": true
                }
            ],
            "id": "execution_spec_accountability",
            "non_claim": "Does not authorize live command execution.",
            "status": "passed",
            "title": "Execution spec accountability"
        },
        {
            "claim": "Current lifecycle receipts and evidence contracts explicitly separate illustrative proof from live evidence.",
            "evidence_paths": [
                {
                    "path": "schemas/execution_receipt.v0.2.schema.json",
                    "present": true
                },
                {
                    "path": "schemas/evidence_contract.v0.2.schema.json",
                    "present": true
                },
                {
                    "path": "engine/public_demo_bundle.py",
                    "present": true
                }
            ],
            "id": "dry_run_evidence_separation",
            "non_claim": "Does not claim live vulnerability evidence.",
            "status": "passed",
            "title": "Dry-run/evidence separation"
        },
        {
            "claim": "Representative runtime decisions can be replayed offline from public-safe fixtures.",
            "evidence_paths": [
                {
                    "path": "examples/replayable-truth-runtime",
                    "present": true
                },
                {
                    "path": "scripts/validate_replayable_truth_fixture.py",
                    "present": true
                },
                {
                    "path": "REPLAYABLE_TRUTH_RUNTIME.md",
                    "present": true
                }
            ],
            "id": "replayability",
            "non_claim": "Does not replay private operator state.",
            "status": "passed",
            "title": "Replayability"
        },
        {
            "claim": "Advertised validation surfaces can be mapped to concrete files in an assembled snapshot.",
            "evidence_paths": [
                {
                    "path": "scripts/build_public_snapshot_manifest.py",
                    "present": true
                },
                {
                    "path": "schemas/public_snapshot_manifest.v0.1.schema.json",
                    "present": true
                },
                {
                    "path": "REVIEWER_VALIDATION_GUIDE.md",
                    "present": true
                }
            ],
            "id": "snapshot_completeness",
            "non_claim": "Does not prove the snapshot is the full live operator workspace.",
            "status": "passed",
            "title": "Snapshot completeness"
        },
        {
            "claim": "Public docs explicitly preserve non-claims around live exploits, production readiness, and protocol completeness.",
            "evidence_paths": [
                {
                    "path": "PROOF_OF_VALUE.md",
                    "present": true
                },
                {
                    "path": "QUALITY_SIGNALS.md",
                    "present": true
                },
                {
                    "path": "PUBLIC_STATUS.md",
                    "present": true
                }
            ],
            "id": "non_claim_preservation",
            "non_claim": "Does not prove superior real-world outcomes by itself.",
            "status": "passed",
            "title": "Non-claim preservation"
        }
    ],
    "schema_ref": "schemas/proof_of_value_scorecard.v0.1.schema.json",
    "schema_version": "v0.1",
    "scope": {
        "dry_run_or_local_only": true,
        "live_target_execution": false,
        "live_vulnerability_claim": false,
        "protocol_adapter_work": false,
        "public_safe": true
    },
    "summary": {
        "dimension_count": 7,
        "failed": 0,
        "passed": 7,
        "status": "passed"
    }
}
